{"time":"1970-01-01T00:00:00.000Z","name":"logEvent","level":"info","data":{},"exception":{"type":"java.lang.UnsupportedOperationException","message":"uoe!","backtrace":[],"data":{"suppressed":[],"cause":{"type":"java.lang.NullPointerException","message":"npe!","backtrace":[],"data":{"suppressed":[]}}}},"context":{"host":"<HOST>","processId":"<PROCESS_ID>","threadId":"<THREAD_ID>"},"id":"<ID>","version":"0"}
