{"time":"2011-11-11T11:11:11.000Z","name":"EncodingException","level":"warn","data":{"originalMessage":"logEvent - foo = {}"},"exception":{"type":"com.arpnetworking.logback.EncodingException","message":"Encoding Exception","backtrace":[],"data":{}},"context":{"host":"<HOST>","processId":"<PROCESS_ID>","threadId":"<THREAD_ID>"},"id":"<ID>","version":"0"}
