{"time":"1970-01-01T00:00:00.000Z","name":"EncodingException","level":"warn","data":{"originalMessage":"logEvent"},"exception":{"type":"com.arpnetworking.logback.EncodingException","message":"Encoding Exception","backtrace":[],"data":{"cause":{"type":"com.fasterxml.jackson.core.JsonGenerationException","message":"Mock Failure","backtrace":[],"data":{}}}},"context":{"host":"<HOST>","processId":"<PROCESS_ID>","threadId":"<THREAD_ID>"},"id":"<ID>","version":"0"}
